{
  "$schema": "https://raw.githubusercontent.com/sorensadrgit-art/soren-sdk/main/schemas/connector.schema.json",
  "schemaVersion": "2.0.0-draft.1",
  "connectorVersion": "0.3.0",
  "connector": {
    "id": "web-platform",
    "name": "Web Platform connector",
    "publisher": "soren-sdk",
    "reviewStatus": "approved",
    "selectable": true,
    "blockers": []
  },
  "product": {
    "canonicalName": "Web Platform",
    "homepage": "https://developer.mozilla.org/",
    "aliases": ["browser-native", "css", "waapi"],
    "categories": ["browser", "css", "platform"]
  },
  "sourceTrust": {
    "sourceAuthority": "official",
    "integrityLevel": "url-recorded",
    "reviewedAt": "2026-07-30",
    "reviewer": "soren-sdk"
  },
  "capabilityClaims": [
    {
      "capability": "platform.css-transition",
      "support": "primary",
      "confidence": 1,
      "conditions": ["The state change is self-contained and expressible with CSS."],
      "limitations": ["Not intended for complex imperative choreography."]
    },
    {
      "capability": "platform.css-animation",
      "support": "primary",
      "confidence": 1,
      "conditions": ["The animation is declarative and expressible with CSS keyframes."],
      "limitations": ["Limited orchestration compared with timeline engines."]
    },
    {
      "capability": "platform.waapi-animation",
      "support": "primary",
      "confidence": 0.95,
      "conditions": ["The project browser targets support the required Web Animations API behavior."],
      "limitations": ["The implementation must manage lifecycle, cancellation, and reduced motion explicitly."]
    }
  ],
  "integrations": [
    {
      "id": "web-platform-built-in",
      "kind": "built-in",
      "mode": "runtime",
      "status": "available",
      "source": "https://www.w3.org/TR/web-animations-1/",
      "version": { "status": "not-applicable" },
      "authorization": { "required": false, "method": "none", "paidPlan": false },
      "executionRisk": "none",
      "dataExposure": "none",
      "permissions": { "filesystem": "none", "network": [], "projectWrite": false },
      "licenseExpression": "not-applicable",
      "fallback": null,
      "notes": ["Requires no third-party runtime package."]
    },
    {
      "id": "web-platform-docs",
      "kind": "documentation",
      "mode": "knowledge",
      "status": "available",
      "source": "https://developer.mozilla.org/en-US/docs/Web/API/Web_Animations_API",
      "version": { "status": "not-applicable" },
      "authorization": { "required": false, "method": "none", "paidPlan": false },
      "executionRisk": "none",
      "dataExposure": "none",
      "permissions": { "filesystem": "none", "network": [], "projectWrite": false },
      "licenseExpression": "CC-BY-SA-2.5",
      "fallback": null
    }
  ],
  "ownershipClaims": [
    {
      "domain": "dom-style",
      "scope": "selected-elements",
      "exclusive": true,
      "properties": ["background", "border", "color", "filter", "opacity", "transform"]
    },
    {
      "domain": "dom-animation",
      "scope": "selected-elements",
      "exclusive": true,
      "properties": ["filter", "opacity", "transform"]
    }
  ],
  "verification": {
    "requiredChecks": ["browser-support", "cleanup", "property-ownership", "reduced-motion"],
    "hardGates": ["connector-schema-valid", "license-policy-resolved", "no-ownership-conflict", "no-unauthorized-permission", "version-policy-resolved"]
  },
  "relatedFiles": {
    "skill": { "path": "./SKILL.md", "status": "present" },
    "sources": { "path": "./docs.sources.json", "status": "present" },
    "compatibility": { "path": "./compatibility.json", "status": "present" },
    "evaluations": { "path": "./evaluations/", "status": "present" }
  },
  "knowledge": { "retrievedAt": "2026-07-30", "staleAfterDays": 30 }
}
